{
    "name"       : "example",
    "password"   : "azerty",
    "machines"   :  1,
    "ab_channel" : "pan6ora",  
    "ab_version" : "2.7.5+pm1.0.3",
    "databases": [],
    "plugins": [],
    "projects": [
        { 
            "name" : "default",
            "databases" : [],
            "plugins"   : []
        }
    ]
}