{
    "name": "example",
    "password": "azerty",
    "machines": 1,
    "ab_channel": "conda-forge",
    "ab_version": "2.9.0",
    "databases": [],
    "plugins": [],
    "projects": [
        {
            "name": "default",
            "databases": [],
            "plugins": []
        }
    ]
}